title,category
"21 people have been treated following Russia spy poisoning, police say",politics
"Taliban hold 80% of Afghanistan, rapidly gaining ground every day ",politics
Don't waste the Cambridge Analytica scandal: it's a chance to take control of our data,technology
The United Nations High Commissioner for Human Rights on Thursday condemned the string of police killings of unarmed African Americans and called for U.S. officers who use excessive force to be charged and convicted for their crimes,politics
Seoul to increase AI-backed surveillance to prevent crime,technology
The United Kingdom has issued the first GDPR notice in relation to the Facebook data scandal which saw the data of up to 87 million users harvested and processed without their consent.,technology
"Oil rigs may end their days as valuable artificial reefs. A large group of international researchers have encouraged environmental authorities across the globe to rethink the idea of removing oil rigs, wind turbines and other installations in the sea when they are worn out.",science
‘800 people’ killed in massacre at Ethiopia’s Ark of the Covenant ,politics
"Trudeau rules out negotiating with protesters, says military deployment 'not in the cards' ",politics
Injecting the flu vaccine into a tumor gets the immune system to attack it,technology
"Trump's pursuit of Greenland leads Danish intelligence to classify island as No 1 security risk. 'A power game is unfolding between great powers,' spy service chief says.",politics
"A new study shows there is a clear link between vitamin D deficiency and oxidative capacity in skeletal muscle. Lacking sufficient levels of vitamin D in the bloodstream may negatively affect muscle function, particularly in older adults, due to a reduction in energy production.",science
Tesla Virtual Power Plant In Australia Outperforms Expectations,technology
Activating newborn neurons suppresses depression and anxiety-like behaviors,science
Turkish woman arrested for 'sharing obscene content' after posting photos from Amsterdam's Sex Museum ,politics
Over 150 Russian officials sign open letter condemning Putin ,politics
French Police Officers In Custody After Video Emerges Of Brutal Beating Of Black Man ,politics
Martian ice-filled crater,science
Google and Facebook reportedly agreed to help each other against potential antitrust action,technology
Researchers discover that ChatGPT prefers repeating 25 jokes over and over,technology
"Left-handedness is associated with greater fighting success in humans, consistent with the fighting hypothesis, which argues that left-handed men have a selective advantage in fights because they are less frequent, suggests a new study of 13,800 male and female professional boxers and MMA fighters.",science
"'Mother of All Data Breaches' — 26 Billion Records Leaked, Users of LinkedIn, X, Venmo And More Panic Over Increased Cybercrime Risk",technology
"Interpol, FBI, and Canada Police Busted 25 'Fake Call Centres' in Noida, India, 300 Cyber Thugs Held",politics
"School Shootings Hit Highest Level on Record, Data Shows",science
Nuclear waste recycled into diamond batteries with 'near-infinite power',technology
Thermal disinfection successfully decontaminated N95 respirators without impairing structural integrity or function,science
"Long-term offenders have different brain structure, study says Study found differences compared with those who did not offend or who only transgressed as adolescents",science
"Canada set to lose 9,000 churches in next 10 years, warns national heritage group -- Shrinking congregations and rising maintenance costs force one-third of Canada's churches to be closed, sold or repurposed",politics
"Intense laser experiments provide first evidence that light can stop electrons: By hitting electrons with an ultra-intense laser, researchers have revealed dynamics that go beyond 'classical' physics and hint at quantum effects.",science
Scientists from the University of Hong Kong have developed a new antibody drug that will not only protect people from contracting HIV but also serve as a long-acting treatment for the virus,science
Kabul Mosque bombing attack today leaves numerous dead. ,politics
The leap second’s time is up: world votes to stop pausing clocks,science
"Scientists have brought 28,000-year-old woolly mammoth cells back to life",science
China is reportedly sending men to sleep in the same beds as Uighur Muslim women while their husbands are in prison camps,politics
Baby teeth may help identify kids at risk for mental disorders,science
Scientists extract oldest ever genetic information from 1.7 million-year-old rhino tooth,science
Kushner reportedly wants Trump to stand by Saudi Arabia and thinks the outrage over Khashoggi 'will pass',politics
Vladimir Putin begins Operation Blame Ukraine ,politics
Google must face $5B lawsuit over tracking private internet use ,politics
Pakistan plane crash: Airbus jet comes down near Karachi airport,politics
"Researchers use infrared light to wirelessly transmit power over 30 meters. Laboratory tests showed that it could transfer 400 mW light power over distances of up to 30 meters. This power is sufficient for charging sensors, & could be increased to levels necessary to charge mobile devices.",science
World’s First Women Cured of HIV After Stem Cell Transplant: She is treated with a stem cell transplant which was donated by a person with natural resistance to the virus that causes AIDS.,science
Second Cambridge Analytica whistleblower says 'sex compass' app gathered more Facebook data beyond the 87 million we already knew about,technology
The BRICS summit ended with no new currency and all 5 members issuing differing and contradictory commentary on de-dollarization ,politics
Singing to pre­term in­fants dur­ing kangaroo care re­duces ma­ter­nal anxi­ety and sup­ports the mother–in­fant re­la­tion­ship.,science
"Physicists have, for the first time, directly imaged small clusters of noble gas atoms at room temperature. This achievement opens up exciting possibilities for fundamental research in condensed matter physics and applications in quantum information technology.",science
France fines Google $120M and Amazon $42M for dropping tracking cookies without consent,technology
"Unveiling the Impact of Anabolic Steroids on Male Fertility: Latest Findings from Fertility and Sterility Highlight Persistent Low Sperm Count Despite Treatment, with Limited Recovery After 6 Months

Read Full Article",science
"A lawsuit accuses Google of systemic racial bias against Black employees, alleging that it pays them less and denies them opportunities",technology
Brexit ferry contract worth £13.8 million awarded to company with no ships or trading history,politics
Solomon Islands set to ban Facebook in the name of 'national unity',technology
"Blind Woman Sees With New Implant, Plays Video Game Sent Straight to Her Brain",technology
Coca-Cola Introduces Innovative Paper Board Technology to Replace Plastic Wrap. The new tech will replace all plastic wraps in European markets by the end of 2021,technology
"A new theory of brain organization takes aim at the mystery of consciousness. Using neural recordings from participants during wakefulness, sleep, coma — each considered a brain “macrostate” — the team found that entropy during consciousness was higher than that during unconscious states.",science
Covid-19 has evolved into two major types (designated L and S),science
China regulator says livestreaming sales stars should speak Mandarin (rather than dialects) and dress well,technology
Stem cells harvested from human urine retain their regeneration and differentiation capability,science
China considers limiting kids' smartphone time to two hours per day | Younger children would face even stricter terms.,technology
"Calculations now show that fireball which passed over the Australian desert in 2016 may have likely been a ""mini-moon"", an object which was temporarily captured in orbit before plummeting to Earth almost vertically.",science
"To Critics Who Say Climate Action Is 'Too Expensive,' Greta Thunberg Responds: 'If We Can Save the Banks, We Can Save the World'",technology
"South Africa Says Putin Will Come for BRICS Summit, Despite ICC Arrest Warrant ",politics
"Tesla whistleblowers filed a complaint to the SEC in 2021, but the agency never interviewed them — Car company may have violated securities law and flouted accounting standards",technology
Opinion | Facebook is creating a dystopian nightmare. It's time to wake up.,technology
"The Amazon may end up like Australia, scientists warn. New study projects rainforest fires are about to become more frequent, due to drier conditions. An additional 1/6th of the forest now calculated to be burnt by 2050.",technology
"Twitter says Trump violated rules against glorifying violence, places public notice on post ",politics
FDA approves nasal spray for depression based on Ketamine,science
"Injecting the gene-editing tool CRISPR into the brains of adolescent mice counteracts the effects of a mutation in a top autism gene. The finding suggests that mutations in this gene, SCN2A, may be treatable at any age.",science
"Researchers combine metalens with an artificial muscle - Artificial eye automatically stretches to simultaneously focus and correct astigmatism and image shift, as reported by Harvard scientists in journal Science Advances.",science
Snap is ordering employees back to the office 4 days a week. CEO Evan Spiegel wants workers to sacrifice ‘individual convenience’ for ‘collective success’ in a policy called ‘default together’,technology
"Since the reintroduction of wolves to Yellowstone National Park in 1995, the park's ecosystem has become a deeply complex and heterogeneous system, aided by a strategy of minimal human intervention. The new study is a synthesis of 40 years of research on large mammals in Yellowstone National Park.",science
"3D printing with light: Rather ﻿than building objects layer by layer, a new kind of 3D printer creates whole structures by projecting light into a resin that solidifies.",technology
Charge mosaics on contact-electrified dielectrics result from polarity-inverting discharges,science
"Admiral Makarov, commissioned in 2017, on fire after being hit by Neptune missiles off Snake Island ",politics
Ottawa approves purchase of 16 F-35 jets worth $7B: sources - National | Globalnews.ca ,politics
Review and viability of a Dyson Swarm as a form of Dyson Sphere,science
"Newborn brains lack maturity to process emotions as adults do, study finds. Brain scans reveal humans aren’t born with brain circuitry that attaches emotions to the things they see or hear in their environment.",science
"Solar at the tipping point of mass adoption in EVs, says IDTechEx",technology
AI tools being used by police who 'do not understand how these technologies work': Study,technology
"China’s ‘purification’ of classrooms: A new law erases history, silences teachers and rewrites books ",politics
Federal Court System Pushes Back Against Free Access To Court Documents,technology
"Researchers have ventured down an entirely different path, deriving caffeic-acid Carbon Quantum Dots (CACQDs) from the grounds, which may have the potential to shield brain cells from the microbiological attacks that can lay the foundations of neurodegenerative disease.",science
Revealed: Tory candidates issued with attack manuals on how to smear rivals,politics
New Drug Could Extend the Lifespans of Giant Dog Breeds,technology
"""First, take a black hole. Now make a second black hole that is quantum entangled with it, which means that anything that happens to one of the black holes will seem to have an effect on the other."" A group of scientist has suggested how to actually perform this extraordinary experiment.",technology
Egyptian official says Hamas refuses Red Cross visit to hostages; Thai captives to be freed as gesture to Iran ,politics
Adobe's latest wearable tech promises dynamic clothing that can change at the push of a button,technology
Airstrike Reportedly Hits Doctors Without Borders Facility In Yemen,politics
New AI neural network approach detects heart failure from a single heartbeat with 100% accuracy,science
ChatGPT posed as blind person to pass online anti-bot test,technology
New research suggests a basic cognitive mechanism underlies the normalization of thin female bodies,science
"87 newly-discovered galaxies, found using Webb space telescope, could be earliest known galaxies in the universe — the first indication that a lot of galaxies could have formed much earlier than previously thought",science
'She's 10': Child Rape Victim's Abortion Denial Sparks Outrage on Twitter ,politics
Site Where Julius Caesar was Assassinated to Open for Public in 2022 ,politics
"Amazon's empire of surveillance: Through recent billion-dollar acquisitions of health care services and smart home devices, the tech giant is leveraging its monopoly power to track 'every aspect' of our lives",technology
"Are societies really ageing? In advanced economies today 75-year-olds have the same mortality rates as 65-year-olds in 1950. When changed mortality rates are used to adjust for “age inflation” in order to determine “real” average age, little or no increase in real age is seen in recent decades.",technology
Termite mounds reveal secret to creating 'living and breathing' buildings that use less energy,technology
New study finds music lessons increase gray matter in older adults: research demonstrates the potential for music learning as a non-pharmacological treatment for age-related cognitive decline.,science
Nikon to stop making SLR cameras and focus on mirrorless models,technology
The Kidney Project successfully tests a prototype bioartificial kidney,science
Chinese Captain and his crew were found guilty of throwing (African) Tanzanian stowaways overboard into shark infested waters due to fears that they brought the Corona Virus on board.,politics
Scientists hail new antibiotic that can kill drug-resistant bacteria,technology
Renault's heavy electric trucks are now available to order,technology
Facebook and Amazon set records in annual spending on Washington lobbying,technology
New Stent-like Brain Implant Allows ALS Patients to Type With Their Thoughts,technology
Evidence from 50 studies in 17 countries indicates that social media usage leads to body image concerns and eating disorders in young people aged 10–24 years,science
Remember when the internet was supposed to be transparent and democratic? There's still hope,technology
Elon Musk is taking ketamine and techies are microdosing mushrooms. So it's OK to do drugs at work now?,technology
Magnitude 7 earthquake strikes Morocco - GFZ ,politics
Plants cry when they suffer stress or violence. New recordings reveal the sound of plants! Microphones placed 10 centimetres from the plants picked up sounds in the ultrasonic range of 20 to 100 kilohertz. Plants could even hear that other plants are short of water f.e. and may react accordingly.,technology
"Living in a corrupt environment makes you more likely to believe in conspiracy theories, regardless of your politics",science
Level responds to lock picker opening its $330 Apple Store lock in seconds,technology
Federal judge halts Arizona ban on filming police within 8 feet,technology
"'Disgusting': NYC Scraps Co-Op Internet in Public Housing So Big Telecom Can Move In | “The people who are working for us also lose their jobs,"" Troy Walcott, president of People's Choice Communications, said.",technology
Wind farms were paid not to generate half their potential electricity,technology
"Your dog is a good boy, but that's not necessarily because of its breed. A new study finds that though some dog behaviors are indeed associated with particular breeds, breed plays less of a role overall than that conventional wisdom holds.",science
Omicron is spreading at lightning speed. Scientists are trying to figure out why — NPR,science
US investigating possible mysterious directed energy attack near White House,technology
"Some 3,000 Tanzanian girls have escaped female genital mutilation (FGM) in five years after using a volunteer-created mapping project ",politics
Ajit Pai Just Got His Second 'Courage' Award of the Year,technology
Taliban Government To Ban Music In Afghanistan ,politics
Senate approves billions for US semiconductor manufacturing,technology
Scientists have found there may be innate genetic differences among people’s psychological connection with natural environments and how they experience them. Results reinforced previous findings that a person’s environment is the predominant driver behind their enjoyment of nature,science
"Neanderthal DNA contributes to genetic diversity, bringing more understanding to human evolution",science
Algae proteins partially restore man's sight,science
Mining billionaire Andrew Forrest pledges $70 million fire relief and recovery donation (Australia),politics
A bug in cell phone tracking firm's website leaked millions of Americans' real-time locations - The bug allowed one Carnegie Mellon researcher to track anyone's cell phone in real time.,technology
Ukraine says it wrecked Russian submarine with British cruise missiles ,politics
"Despite the web users and the software and application developer's continuous effort to make and keep the IT infrastructure safe by using encryptions, digital signatures or digital certificates, this paper focuses on the problem of phishing and to detect/predict it by using 'machine learning'",science
U.S. senators urge Trump administration to end nuclear talks with Saudis,politics
"Russians Have Right To Feel 'Cheated' By Move To Allow Putin Stay In Power Until 2036, Says Constitution Author",politics
Why Washington wants to treat Apple and Google like Big Banks,technology
"Doctors fear Google skin check app will lead to ‘tsunami of overdiagnosis’. There are nearly 10bn Google searches for skin, nail and hair issues each year, prompting the tech giant to create a ‘dermatology assist tool’.",technology
Massive school data breach shows we need better privacy policies,technology
"A meta-analysis of thirty country-level studies has found that climate change triggers migration, particularly in middle-income and agricultural countries.",science
"Vandals destroy 22,000-year-old sacred cave art in Australia, horrifying indigenous community ",politics
"Chinese vessels detained by Vanuatu, accused of fishing illegally ",politics
Solar farm the size of 313 football fields to be built at Edmonton airport,technology
[Australia] 'Quit the bulls**t': Climate protesters dump manure outside News Corp offices over claims of denialism ,politics
Scientists from Poland and Germany opened the gates to the land of attophotography by removing one of the last obstacles hindering the photography and filming of processes occurring i.e. billionths of a billionth of a second,technology
Protesters use lasers to tackle heavily armed police and bring down drone in Chile | Protesters in Chile are using handheld lasers to take on riot police and bring down drones monitoring the mass protests against the government. The tactic appears to have spread from Hong Kong,politics
Technology companies are facing a new crisis as their employees press executives to rethink their work with the Trump administration and in many cases drop lucrative federal contracts,technology
"University of Zurich have developed a machine that repairs injured human livers and keeps them alive outside the body for one week. This breakthrough may increase the number of available organs for transplantation, saving many lives of patients with severe liver diseases or cancer.",technology
Elizabeth Holmes Brushed Off Patient Risks: ‘They Don’t Put Pretty People Like Me in Jail’,technology
Earth’s average 2023 temperature is now likely to reach 1.5 °C of warming ,politics
"New cocoa processing method called ""moist incubation"" results in a fruitier, more flowery-tasting dark chocolate, researchers say",science
"Superconductor research surges forward despite controversy over stunning claims. With his bold claims of revolutionary room-temperature superconductors, physicist Ranga Dias of the University of Rochester in New York propelled the field of high-pressure physics into the spotlight.",science
Russian COVID Vaccine Creator found strangled to death with belt ,politics
Curiosity is key to early childhood success in math and reading. New research links curiosity levels in young children with later academic success -- researchers call for more early learning interventions that support inquisitiveness,science
Argentina senators vote against legalising abortion in first 14 weeks of pregnancy,politics
Russia’s fabled war ally ‘General Frost’ turns on Moscow ,politics
"Facebook paid FTC $4.9B more than required to shield Zuckerberg, lawsuit alleges",technology
The FTC is looking into the Amazon and Apple deal that crushed small resellers,technology
"Prigozhin names Ukraine as one of the world’s top armies, stating the obvious ",politics
Don't be fooled: Net neutrality is about more than just blocking and throttling,technology
"Newegg Apologizes for Customer Service Failings, Promises Change",technology
"Putin calls West an ""Empire of Lies"" after sanctions imposed ",politics
[How to] Keep your ISP’s nose out of your browser history with encrypted DNS,technology
Swiss team build's world's smallest motor - constructed from just 16 atoms and has a 99% directional stability,science
Mexico pipeline blast killed 66 people: state governor,politics
"Four global drinks giants are responsible for more than half a million tonnes of plastic pollution in six developing countries each year, enough to cover 83 football pitches every day, according to a report.",technology
America's renewable energy set to surpass coal for the first month ever,technology
"New Zealand: majority of callers to new sexual harm helpline are teenage girls - A nationwide sexual harm helpline in New Zealand has received more than 1,200 phone calls in its first month of operation; the majority of them teenage girls aged 13-19.",politics
‘Disinformation on steroids’: is the US prepared for AI’s influence on the election?,technology
Tesla Sold Only One Car in Korea in January,technology
Thailand cave rescue: all 12 boys and coach successfully rescued,technology
Proxima d: Astronomers discover new planet orbiting nearest star to our solar system,science
"Cruise CEO says SF ‘should be rolling out the red carpet’ for robotaxis, threatens to maybe leave town",technology
'All of it is a lie': Russian paratrooper condemns his country's war in Ukraine ,politics
Coconut rhinoceros beetle makes unexpected ‘host shift’ to Guam’s threatened cycad trees,science
"Taliban leader scolds fighters for taking selfies, wearing sunglasses & ‘fashionable’ clothes ",politics
"Tools found in Moroccan cave are evidence of fur and leather clothing being made and worn 120,000 years ago",science
Why biologists like Carl Bergstrom are warning that social media is a risk to humanity,technology
Trump: If I Was President I’d Threaten to Drop a Nuclear Bomb on Russia ,politics
Germany launches world's first autonomous tram in Potsdam,technology
A New Factory in France Will Mass-Produce Bugs as Food,technology
“Vertical forest” residential complex in China almost empty since completion in April due to unforeseen swarms of mosquitos drawn to the verdant plantings,technology
U.S. can reach 90% clean electricity by 2035,technology
"Microsoft wins U.S. Army contract for augmented-reality headsets, worth up to $21.9 billion over 10 years",technology
Theresa Villiers: Ex-environment secretary failed to declare Shell shares ,politics
"Chicago cops can use fake social media profiles to spy on you, with the FBI's help.",technology
"Researchers have 3D printed a heart using a patient’s own cells. It could be used to patch diseased hearts - and possibly, for full transplants. The heart is the first to be printed with all blood vessels, ventricles and chambers, using an ink made from the patient’s own biological materials.",technology
"US government wants Nintendo hacker Gary Bowser behind bars for five years ""to provide just punishment""",technology
"Experts are worried about the damage air pollution is doing to us. Air pollution has been linked, over decades of research, to everything from diabetes and obesity to learning disabilities in children to dementia and even brain cancer.",technology
Elon Musk says Twitter deal temporarily on hold,technology
Russian opposition leader Alexei Navalny detained by police at Moscow rally (Navalny on Twitter),politics
3D imaging of fat reveals potential targets for new obesity treatments. Scans of fat tissue in mice identify potential targets for new drugs to treat and prevent obesity and diabetes.,science
"U.S. Army Planned to Pay Streamers Millions to Reach Gen-Z Through Call of Duty | Internal Army documents obtained by Motherboard provide insight on how the Army wanted to reach Gen-Z, women, and Black and Hispanic people through Twitch, Paramount+, and the WWE.",technology
‘About damn time’: First Nation gets clean water after 24-year wait ,politics
Sam Bankman-Fried found guilty on all seven counts,technology
Study: COVID19 lockdowns didn't increase suicide rates,science
A new nanoparticle drug-delivery system resulted in unprecedented siRNA penetration across the intact blood-brain barrier. Researchers say the system could help doctors to treat secondary injuries associated with TBI that can result in Alzheimer’s and other neurodegenerative disorders.,science
'Lefty DNA' found - and it changes brain structure,science
