title,category
Leaked documents show Amazon's seller lending business is booming. But the company's economists are worried about defaulters,technology
Panasonic planning massive battery plant in U.S. to supply Tesla -NHK,technology
"New study shows that stroke byproduct acrolein activates the precursor of heparanase, an enzyme that degrades glycocalyx in the blood-brain barrier. The team's discovery is critical, as the acrolein-modified proHPSE could be a novel and potentially effective drug target for post-stroke inflammation.",science
"Researchers discover that the brains of bees and wasps can recognize faces. This is despite the tiny size of the insects' brains. They contain fewer than one million brain cells, compared with the 86 billion that make up a human brain.",science
"In China, classroom cameras scan student faces for emotion, stoking fears of new form of state monitoring",politics
Tesco website and app disrupted following 'attempt to interfere with our systems',technology
Blind Man Regains Sight After 1st Synthetic Cornea Implantation By Israel's CorNeat,technology
"Adding A Nylon Stocking Layer Could Boost Protection From Cloth Masks, Study Finds",science
"Drones enabled the use of defibrillators before ambulance arrival. In more than half of the cases in the study, the drones were ahead of the ambulance by an average of 3 minutes. In cases where the patient was in cardiac arrest, the drone-delivered defibrillator was used in a majority of cases.",science
A Drunk Russian Soldier Arrested for Beating a Captain to Death ,politics
Germany refuses to bow to UK pressure to resume arms sales to Saudi Arabia,politics
"Robinhood Customers Sue Over Removal of GameStop, Others",technology
"Effects of 5 Years Aerobic Exercise on Cognition in Older Adults: The Generation 100 Study: A Randomized Controlled Trial - Sports Medicine — Overall, exercise was not significantly associated with cognition among older adults.",science
Yune Lee from Ohio State University talks about his research into how even minor hearing loss can increase the cognitive load required to distinguish apoken language.,science
"It is physically impossible to destroy Kakhovka HPP by shelling, it was blown up by the occupiers - Zelensky ",politics
"Strength of imagination is not associated with creative ability or learning achievement, suggests new research based on a lab‐based (n=180) and online study (n=128), which found being more imaginative is associated more with having schizotypal beliefs (or non-helpful “cognitive eccentricities”).",science
"Research shows water can spontaneously transform into hydrogen peroxide, contributing to the understanding of the formation of hydroxyl radicals and hydrogen peroxide as an overlooked contributor to the well-known seasonality of many viral respiratory diseases, including colds, flus, and COVID-19",science
"After 20 years, the U.S. Army is shutting down its recruitment video game, ‘America’s Army’",technology
"Climate change on track to wipe out polar bears by end of century, study warns ",politics
"There is a new way to recycle plastic. There is a fungi which ""eats"" plastics and then you can eat the mushroom",science
Teenager finds classical alternative to quantum recommendation algorithm,technology
US Abrams tanks for training Ukrainian forces arrive in Germany ahead of schedule ,politics
"In Cornwall, UK a 70-yr-old granny cleans up 52 beaches in a year after enjoying a documentary about plastic contamination",politics
The 2016 heatwave that caused mass bleaching of coral in the Great Barrier Reef also reduced fish diversity in the ecosystem.,science
Style Transfer is a Machine Learning algorithm that can turn a grey box game environment into a fully textures world based on a reference image,technology
Ukrainian Bradley IFV obliterates two Russian T-72 tanks in single battle ,politics
GM worker blames Trump for job cuts,technology
"Highest omega-3 levels cut death risk by 13%. Research was adjusted for multiple personal factors, scientists believe that these are the strongest data published to date supporting the view that over the long-term, having higher blood omega-3 levels can help maintain better overall health.",science
"As with humans, young male chimpanzees are more inclined to take risks than females and older males are.",science
A team led by IIT Kanpur has found the mechanism responsible for aggressive return of prostate cancer in treated patients. They also found that treating prostate cancer cells showing elevated SPINK1 protein with a drug against Casein Kinase 1 resulted in reduced cancer cell growth and aggressiveness,science
"Another Russian army general has been killed in action in Ukraine, governor says ",politics
Black silicon photodetector breaks the 100% efficiency limit,technology
Norway's PM says Russia build-up is 'a sign of weakness' ,politics
"Using theoretical calculations, an international team of researchers shows that it would not be possible to control a superintelligent AI. Furthermore, the researchers demonstrate that we may not even know when superintelligent machines have arrived.",science
Scientists Set to Explore a Deep 'Blue Hole' at the Bottom of the Ocean,science
"Elon Musk says upcoming version of Neuralink is ""awesome""",technology
"Report: Amazon illegally confiscated union pamphlets from a warehouse worker and creeped on a pro-union barbecue, NLRB says",technology
"Ottawa has ""no plans"" to recognize Taliban as legitimate government of Afghanistan: Trudeau ",politics
A CNN reporter tried Tesla's Full Self-Driving in New York City. It kept trying to turn into oncoming traffic,technology
Young children who practice visual working memory and reasoning tasks improve their math skills more than children who focus on spatial rotation exercises.,science
Belarus helicopters entered Poland’s airspace as provocation ,politics
Dental cavities and root lesions suggest human ancestors had the same dental problems as us – even without fizzy drinks and sweets,science
A scientist who genetically edited babies to be HIV-resistant was just sentenced to 3 years in prison. Here's how he did it and why scientists around the world are outraged.,science
Blinken says 'a single additional Russian force' entering Ukraine would trigger US response ,politics
"Ukraine will 'no doubt' join NATO when war with Russia ends, US defense secretary tells CNN | CNN Politics ",politics
"Some of the greatest mysteries in cosmology revolve around antimatter. A team of physicists has outlined a relatively simple new way to create antimatter, by firing two lasers at each other to reproduce the conditions near a neutron star, converting light into matter and antimatter.",science
Dogs distinguish human intentional and unintentional action | Scientific Reports,science
"France: 900,000 Book Vaccine After Health Passport for Dining Out ",politics
The Rocket Motor of the Future Breathes Air Like a Jet Engine,technology
A town mayor has been expelled from the Labour party for saying Boris Johnson ‘completely deserves’ to have coronavirus.,politics
"Eating tofu and other foods high in isoflavones more than once a week was associated with an 18% lower risk of heart disease compared to those who ate tofu less than once a month, according to a new study published in Circulation, the flagship journal of the American Heart Association",science
"Why Facebook keeps failing in Ethiopia | Leaked documents show the company can't keep up with the volume of hate speech on the platform, which is leading to real-world violence.",technology
"No two female genitalia are exactly alike. In an analysis of more than 650 women ages 15 to 84, Swiss researchers measured various genitalia, including the clitoris, labia majora and labia minora, and found that vulval appearance differed significantly woman to woman.",science
Pirated e-book site Z-Library vanishes—sending college students into a panic,technology
"More than 30,000 active duty personnel and veterans of the post-9/11 wars have died by suicide, nearly three times as many as service members killed in post-9/11 war operations. The study also estimates that the actual number of post-9/11 veteran suicides is higher than recorded",science
German firm Bosch gets smartglasses right with tiny eyeball lasers: A tiny laser array paints images directly onto your retina,technology
"When heterosexual men desired real-life sex to be just like the sex portrayed in stereotypical pornography and the actual sex they are having fails to reach those impractical ideals, they were less sexually satisfied and expressed lower self-esteem.",science
U.K. cut off thousands of pensioners in Canada for failure to provide 'proof of life'. ,politics
Fox News won a court case by 'persuasively' arguing that no 'reasonable viewer' takes Tucker Carlson seriously. Opinion: fox is setting a dangerous legal precedent that lets them actively brainwash their viewers. ,politics
"American woman found with a gun after landing in Japan, gets sent back to Atlanta",politics
Tibetan monk’s account reveals torture and sexual abuse rampant in China’s ‘political re-education’ centres,politics
Russia’s Su-34 Fighter-Bombers Are Falling In Startling Numbers ,politics
Municipalities across Japan are reaching out to the social recluses known as hikikomori to help them find their place in society without focusing solely on getting them back into the workforce.,politics
"Mars methane hunt comes up empty, flummoxing scientists",science
Solar farms in space could be renewable energy's next frontier,technology
"Study links high cholesterol, cardiovascular disease to plastics",science
Putin’s Top Propagandist Urges Russians to Embrace Death ,politics
"Another top Russian commander killed: Elite paratroop colonel and his deputy are 'liquidated' by Ukrainians as death toll in Putin's army hits 7,000 ",politics
Iran confirms its navy seized tanker in Gulf of Oman that was boarded by men in military uniforms ,politics
"Pain can be a self-fulfilling prophecy: New brain imaging research shows that when we expect something to hurt it does, even if the stimulus isn't so painful. Surprisingly, those false expectations can persist even when reality repeatedly demonstrates otherwise, reported in Nature Human Behaviour.",science
A Russian rocket that struck a Ukrainian train station and killed dozens of people had 'For the children' written on its side ,politics
UN chief denounces ‘suicidal’ failure to tackle climate change ,politics
Vladimir Putin Says Ready For Military Alliance Between Russia & China To Counter NATO ,politics
Nepal becomes first country in Asia Pacific to vaccinate refugees against COVID-19 ,politics
Physicists Caught Two Atoms 'Talking' to Each Other,science
"Prince Andrew lobbied US government for better plea deal for a former friend in the disgraced late financier’s underage prostitution case, newly released Ghislaine Maxwell documents claim ",politics
"Brown crabs can’t resist the electromagnetic pull of underwater power cables and that change affects their biology at a cellular level: “They’re not moving and not foraging for food or seeking a mate, this also leads to changes in sugar metabolism, they store more sugar and produce less lactate""",science
At least 39 reported killed in Myanmar as Chinese factories burn ,politics
The Popularity of E-Bikes Isn’t Slowing Down | Motorized bicycles are outselling all-electric cars and have the potential to transform urban transit.,technology
‘Exercise utmost caution’: India issues advisory for its nationals in Canada ,politics
"More solar panels need to be made in Europe to cut dependency on Russian gas, says EU ",politics
"Russian officers refused to collect the bodies of dead troops so the military wouldn't have to pay their families, convict soldier says ",politics
"Russia loses Interpol presidency vote | Interpol has elected South Korean Kim Jong-yang as its president, rejecting the Russian frontrunner who had been accused of abusing the international police body's arrest warrant system",politics
Ex-Tesla employee reveals shocking details on worker conditions: 'You get fired on the spot.',technology
China is kicking out more than half the world’s bitcoin miners – and a whole lot of them could be headed to Texas,technology
Senior BBC scheduler to be disciplined for antisemitic Facebook posts referencing the 'holohoax' ,politics
PlayStation 2 repair services close in Japan. Sony ends its repair service for the PS2 more than 18 years after the console went on sale.,technology
"'Free Speech Absolutist' Elon Musk Censors Employees, Critics",technology
Russia Arrests Generals in Charge of Moscow's Air Defenses ,politics
Honda's new $4.4 billion EV battery plant will be built in Ohio,technology
Aircraft Could Cut a Big Chunk of Their Emissions Just by Riding The Winds,science
"Bosses think workers do less from home, says Microsoft",technology
An Amazon factory whistleblower who says he was tortured by Chinese police before being jailed has called on Jeff Bezos to help overturn his conviction,technology
Engineering marvel: Sixth mirror cast for Giant Magellan Telescope,technology
"The ability to live in the moment and accept your emotions, when combined with expressing your feelings through words and touch, can serve to get you through stressful times that can test the quality of your relationship, finds a new study (n=281) exploring mindfulness and relationship quality.",science
Swiss researchers identify new bacteria in permafrost,science
Thousands of lions are being bred in brutal ‘farms’ to be shot by hunters are slaughtered for Chinese medicine,politics
Vanishing phone customer support is driving us all insane,technology
Graphics card makers will be “forced to slash prices” after GPU shipments fall by 40%,technology
Two members of Pussy Riot given Icelandic citizenship after fleeing Russia. ,politics
The first lab-grown meat for sale could come from this Singapore startup that’s re-creating shrimp,technology
‘We are being ignored’: Brazil’s researchers blame anti-science government for devastating COVID surge ,politics
"‘There is no such thing as a real picture,’ says Samsung exec.",technology
The White House Transcript Is Missing the Most Explosive Part of the Trump–Putin Press Conference,politics
"Department of Defense funding first large-scale clinical trial of marijuana as treatment for autism symptoms, as evidence for it grows",technology
Controllable blood–brain barrier (BBB) regulation based on gigahertz acoustic streaming,science
‘I’ll inject the vaccine in your butt’: Philippines president threatens to arrest those who refuse vaccination ,politics
"One million species face extinction, U.N. panel says. And humans will suffer as a result.",science
German government advises against using Kaspersky antivirus,technology
Device that works like a lung makes clean fuel from water,technology
"Falling total fertility rate should be welcomed, population expert says",politics
"Professor Feng Zhang's team discovered and characterized the first programmable RNA-guided system in eukaryotes, which centers around an RNA-guided endonuclease named Fanzor.",science
Study: Tennessee hospital rates up most where masks optional,technology
"Leaked document shows Amazon's flawed job-posting process led to 'over-hiring,' with one team listing 3 times more openings than approved for",technology
"San Francisco says tiny sleeping 'pods,' which cost $700 a month and became a big hit with tech workers, are not up to code",technology
"Consumer Acceptance of Self-Driving Cars Soars, Study Says - By 2029, driverless cars will be preferred mode of transportation for large majority.",technology
"New research reveals that many lakes in the continental United States are becoming ""murkier, with potentially negative consequences for water quality and aquatic life. In the 5 years between 2007 and 2012, the dominant lake type in the United States shifted from clear, blue lakes to greenish-brown",science
Earth's energy imbalance removes almost all doubt from human-made climate change.The findings undercut a key argument used by people who do not believe human activity is responsible for the bulk of climate change ,politics
"Study finds that red seaweed dramatically reduces the amount of methane that cows emit, with emissions from cow belches decreasing by 80%. Supplementing cow diets with small amounts of the food would be an effective way to cut down the livestock industry's carbon footprint",science
Varjo XR-1 is the first truly good MR/XR headset allowing full control over reality/virtual reality enabling hyper-real AR/VR visuals,technology
"Narcissists aren't necessarily on the hunt for partners who are already in a relationship - but that doesn't appear to stand in their way. Narcissism is marked by selfishness, arrogance, an inflated sense of self and extroversion. They believe they're special, unique and entitled",science
"Scientists have effectively generated free electrons from organic semiconductors, a new 2D material that may lead to cheaper solar panels and electronics by potentially allowing printing of electronic devices using a simple inkjet printer, or even painting a solar panel onto the wall of a building.",science
49% of voters believe Kremlin interfered in Brexit referendum - Opinium poll for the Observer also reveals 47% of public think Putin’s government affected UK’s 2019 general election ,politics
Apple buys every 3 nm chip that TSMC can make for next-gen iPhones and Macs,technology
Meta's AI guru LeCun: Most of today's AI approaches will never lead to true intelligence,technology
"Scientists demonstrate a new method of producing a specific class of organic compounds, which promises to accelerate drug discovery research for several diseases. The use of malonates as reactant is what allows this multi-functionalization, setting this novel method apart from existing methods.",science
"I got Putin wrong, Nord Stream 2 was a mistake, says German President Steinmeier ",politics
Czech Chief of General Staff admits possibility of NATO war against Russia ,politics
Norwegian TV journalists covering the 2022 World Cup arrested in Qatar ,politics
"Germany's Green party: Ban dangerous chemicals on high seas - Hazardous substances have no business on ocean liners, the German Green party has said after a cargo ship lost 270 containers in the North Sea.",politics
Reddit Fires Aimee Knight As Controversial Hire Sees Hundreds of Subreddits Go Private,technology
"COVID-19 patients retain elevated risk of death for at least 18 months after infection. COVID-19 is associated with higher risks of cardiovascular disease and death in the short- and long-term, according to a study in nearly 160,000 patients",science
"World on track to miss emissions ‘turning point’ for tackling climate change | The world is not on track to meet the greenhouse gas “turning point” required to avoid the most catastrophic impacts of climate change, experts have warned",politics
"Scientists may have finally found a solution to sodium battery design by mimicking a common biological construct: mammal bones. By designing a cathode with a soft interior and tough exterior, scientists were able to create a battery that maintains 91 percent charge capacity over 10,000 cycles.",science
New High-Precision Technology Cuts Atom-Sized Patterns Into 2D Materials,technology
"RTO doesn’t improve company value, but does make employees miserable: Study",technology
"A lawsuit claims OpenAI stole 'massive amounts of personal data,' including medical records and information about children, to train ChatGPT",technology
"For people with diabetes, healthy eating is not enough if their diet is rich in ultra-processed foods",science
Russia has one day to pay $650 million in foreign bonds or default ,politics
‘Renewables saved Brits £5.7bn this winter’,technology
California agency accuses Tesla of racial segregation at factory,technology
"A major French aquarium vendor has announced it will stop selling the “classic” round fish bowls because they are cruel, driving fish mad and killing them quickly.",science
[Video] BAMBOO - The industry of the future. Smart tropical countries are transitioning from logging to forestry. Bamboo is perfect for them.,technology
"Canadian conservatives, who plan to eliminate 10,000 teaching jobs over 3 years, say they want Canadian education to follow Alabama's example",politics
"Russia, China block plans for Antarctic marine protections ",politics
Swedish Firm to Unlock the Electricity of the Sea With Largest Wave Power Station in the World,technology
"Stanford University scientists have now demonstrated that the magnetism in lunar samples is not adversely altered by the spacecraft journey back to Earth or certain laboratory procedures, disproving one of the two major oppositions to the ancient dynamo theory.",science
Analysis of data from 6.2 million people finds no significant associations between mRNA COVID-19 vaccines and serious side effects,science
The ocean is about to flip a switch that could permanently disrupt life on Earth: study ,politics
Cannabis Impaired Driving has not Risen A Month After Legalization,politics
Bay Area police try out controversial AI software - Critics worry policing by algorithm may reinforce bias,technology
"Trump should win the Nobel Peace Prize, says South Korea's Moon",politics
"Conspiracy beliefs likely do not have beneficial consequences, but may even reinforce the negative experience of anxiety, uncertainty aversion, and existential threat. (N=405, N=1,012)",science
Millions of smart meters will brick it when 2G and 3G turns off,technology
"Iranian IM Plays Without Hijab At World Championships, Defects To Spain ",politics
New bipartisan bill would require labeling of AI-generated videos and audio,technology
"In 200 years, humans reversed a climate trend lasting 50 million years: If global warming continues unchecked, Earth in 2030 could resemble its former self from mid-Pliocene 3 million years ago, according to a study published Monday",politics
"Dunning-Kruger Effect: Ignorance and Overconfidence Affect Intuitive Thinking, New Study Says",science
Ukraine tensions: Russia condemns destructive US troop increase in Europe ,politics
"US DOJ to sue Apple for antitrust violations, Bloomberg News reports",technology
Trump denies he ever worked for Russia,politics
Map of the dark web which showcases over 6000 onion sites with a screenshot of each,technology
Thousands march in Montreal to denounce the rise of anti-Asian hate crime ,politics
"First-of-its-kind study showed that, when performing a task that didn’t demand constant attention, people were able to strategically allow their minds to wander without an impact on task performance",science
Economists Agree That Stronger Legal Liability for Online Platforms Would Reduce Disinformation,technology
"Human Modification of The Ocean Is as Rampant as Urbanisation on Land, Study Finds",science
It's official - open source software has never been more important,technology
"SpaceX Paid $250,000 to a Flight Attendant Who Accused Elon Musk of Sexual Misconduct",technology
"Researchers find a new version of carbon-fixing enzyme rubisco, the world's most abundant protein",science
Lebanon's army finds nearly 5 tons more of highly explosive ammonium nitrate at Beirut port. ,politics
Experiencing sexual regret doesn’t appear to result in less regrettable behavior in the future. New research explores why women tend to regret engaging in casual sex while men tend to regret passing up such opportunities. Sexual regret does not appear to serve an adaptive function.,science
SpaceX has launched the first 60 satellites of its space internet system,technology
"Scientists have succeeded for the first time in directly reprogramming human blood cells into neural stem cells. They can be modified with CRISPR and multiplied indefinitely in the culture dish, and can represent an important basis for the development of regenerative therapies.",technology
"Despite Parler backlash, Facebook played huge role in fueling Capitol riot, watchdogs say",technology
"A new technology could kill 99.9% of the deadly germs in the air. The study suggests that non-thermal plasma – a cool gas made up of electrically charged particles, despite having no overall charge – could inactivate airborne viruses and provide sterile air.",technology
"On 4/20, Chuck Schumer To Introduce Bill To Decriminalize Marijuana",politics
"CBD Curbs Cravings and Anxiety of Heroin Addiction, Researchers Find",science
"A surplus of food on its own was not enough to drive the transition from hunter-gatherer societies to the hierarchical states. New Hypothesis proposed that only when humans began farming food that could be stored, divvied up, traded, and taxed, did social structures begin to take shape.",science
"Governor, FCC vow probe into false alarm that sent Hawaii scrambling for cover: FCC Chairman Ajit Pai promised a ""full investigation"" into a false emergency alert...",technology
"Biden says there ""will be no Nord Stream 2 pipeline"" if Russia invades Ukraine. ",politics
Russian propagandist Solovyov urges Russians not to fear death: Life is overrated ,politics
Gulf of Oman: Unconvinced EU foreign ministers call for independent investigation after US claim Iran is behind tanker attack,politics
Digitally Altered ‘Deepfake’ Videos A Growing Threat As 2020 Election Approaches | NBC Nightly News,technology
Taiwan’s ruling party secures record third term as VP Lai Ching-te wins presidential vote ,politics
