title,category
"Contaminated drinking water alerts cause up to 10% school absence rates in Jackson. Each time an alert was issued, unexcused absence rates in Jackson's public schools increased between 1% and 10%.",science
"""The election of a populist mayor leads to smaller repayments of debts, a larger share of procurement contracts with cost overruns, higher turnover among top bureaucrats—driven by forced rather than voluntary departures—and a sharp decrease in the percentage of graduate bureaucrats.""",science
"Collective frustration sparks riots, mass violence regardless of age, politics, or gender according to new experimental psychology research using video game simulations.",science
"Inactivity during childhood could increase the chance of heart attacks and strokes later in life, and children and teenagers need to move more to protect their long-term health",science
Norway has switched to electric cars. And in their cities you can breathe cleaner air than ever,technology
Zelenskyy creates council on liberation of Crimea ,politics
Seawater into clean drinking water in less than 30 minutes using the power of sunlight,technology
Robots are coming for the lawyers – which may be bad for tomorrow's attorneys but great for anyone in need of cheap legal assistance,technology
When You Exercise Might Determine the Amount of Fat You Burn,science
"Reuters: ""EU plans 'Chips Act' to promote semiconductor self-sufficiency""",technology
"‘Not what we agreed to’: Canada at odds with U.S. changes to text of USMCA, source says",politics
"US announces highest-level visit to Taiwan in decades, risking China anger ",politics
Warsaw City Hall: Half a million people turn out to protest Poland's right-wing government ,politics
"Microsoft has been collaborating with researchers linked to a Chinese military-backed university on artificial intelligence, elevating concerns that US firms are contributing to China's high-tech surveillance and censorship apparatus.",politics
'Russian hackers were able to penetrate the control rooms of hundreds of U.S. utilities last year as part of a campaign against power company vendors that could be ongoing',technology
Animal evolution explains why social distancing is so difficult: New analysis of long-term studies on social mammals (including humans) finds that being social is one of the strongest factors determining morbidity and mortality.,science
Unique discovery in Erasmus MC: antibody against corona - Erasmus Magazine,technology
"Facebook enforces ban on gun sales with 10-strikes-and-you’re-out policy | 10-strikes policy on gun sales revealed in ""internal guidance"" obtained by WaPo.",technology
"'Bone eaters' are back: Europe's largest vultures return to French Alps - Europe's largest vultures nicknamed ""bone eaters"" whom legend has it used to kidnap old ladies, can be seen soaring high over the French Alps once again after disappearing from the region in the early 20th century.",politics
"Optoelectronic engineers manufactured special type of LCD that is paper-thin, flexible, light and tough. A daily newspaper could be uploaded onto a flexible paperlike display that could be updated as fast as news cycles, that will be cheap to produce, perhaps only costing $5 for a 5-inch screen.",science
"A huge wetland is burning in Brazil, and the fires are far bigger than California's (while president Bolsonaro deny the issue) ",politics
"The study of memes dedicated to the coronavirus from Reddit , shows that memes can offers a new and rich domain of research that can lead to reconsider the role of mastery, elaboration, and humor in creativity within and beyond social media.",science
"Priests committed over 1,000 sex crimes in Switzerland since 1950 ",politics
On the Way to the Radically Superintelligent Civilization: Why Is It Important to Implement UBI?,technology
Apple ordered to pay $308.5 million after jury finds it infringed on digital rights management patent,technology
"Microsoft unveils AI model that understands image content, solves visual puzzles",technology
Rolls Royce Partners With Intel to Build Autonomous Ships,technology
"Mexico has made clear it will never pay for President Donald Trump’s planned southern border wall, the country’s economy minister said on Thursday, after the U.S. leader again insisted he would make Mexico pay for the barrier.",politics
Prague to risk Russian wrath by naming square after Boris Nemtsov - Rebranding area in front of Russian embassy after Putin critic has ‘huge symbolic value’,politics
Study Finds ‘Single Largest Driver’ of Coronavirus Misinformation: Trump - Cornell University researchers analyzing 38 million English-language articles about the pandemic found that President Trump was the largest driver of the “infodemic.” ,politics
"Researchers have discovered the secret of why coffee (and certain food, drinks) smell, and likely taste, disgusting to people: they are affected by parosmia, or distorted sense of smell, something related to nerves and receptors because that’s how odor and aroma molecules are detected",science
H&M lines up supply chain to deliver protective gear to hospitals across the European Union.,politics
Study finds that genetics are not a significant determining factor of childhood obesity,science
CRISPR gene-editing creates wave of exotic model organisms - But the practical challenges of breeding and maintaining unconventional lab animals persist.,technology
Facebook’s Australia news ban is the best decision it’s ever made,technology
Ex-CIA programmer gets 40 years for passing spy secrets to WikiLeaks,technology
"Big four oil companies 'reneging on clean energy promises', with one refusing to invest in solar and wind ",politics
Canada's envoy to Ukraine says Canadian support will outlast Russian invasion ,politics
How a few geothermal plants could solve America's lithium supply crunch and boost the EV battery industry,science
Zuckerberg Loses $7 Billion in Hours as Facebook Plunges,technology
CIA chief: China has some doubt on ability to invade Taiwan ,politics
"Hamas founder's son, former informant breaks silence, slams Hamas ",politics
"Social media plays a role in spreading misinformation and can negatively influence people’s attitudes about vaccine safety and effectiveness, but fact-check tags located immediately below or near a post can play a pivotal role in debunking myths.",science
"Guardian article with IPCC models of rain, fires, heat and changes due to climate change",science
'End of academic freedom': University of Hong Kong to fire pro-democracy activist and law professor Benny Tai ,politics
"Aliens will likely be discovered within 30 years, Nobel Prize-winning astronomer says - He was awarded 2019 Nobel Prize in Physics on Tuesday for 'groundbreaking discoveries'",technology
Hong Kong Firefighters And Firetrucks Show Up to Support the Students,politics
Russia’s Latest Hack Shows How Useful ‘Criminal Groups’ Are to the Kremlin,technology
"Older adults more likely than young to be fooled by 'fake news. Falling for fake news can have significant physical, emotional and financial consequences, especially for older adults who may have their life savings or serious medical issues at stake",science
Study uncovers a surprising temporal relationship between cognitive function and physical activity,science
"New peer reviewed article shows engineers, men and businesses are over represented on post disaster rebuilding committees",science
Largest study yet finds early birds less prone to depression,science
‘They’re criminals’ – Police to go after LGBTQ members in Nigeria ,politics
Being Denied an Abortion Has Lasting Impacts on Health and Finances,science
Global salmon farming harming marine life and costing billions in damage | ,politics
"Elite philanthropy mainly self-serving - Philanthropy among the elite class in the United States and the United Kingdom does more to create goodwill for the super-wealthy than to alleviate social ills for the poor, according to a new meta-analysis.",science
Explosion at Russian lab known for housing smallpox virus,politics
"Mexico lifts ban on fishing in vaquita habitat, potentially dooming endangered porpoise ",politics
Harvard Study: CBD May Significantly Reduce Anxiety With Minimal Side Effects,science
Google will pay $392 million to 40 states in largest-ever US consumer privacy settlement,technology
New ransomware doesn’t just encrypt data. It also meddles with critical infrastructure. A ransomware strain discovered last month and dubbed ‘Ekans’ contains code that actively seeks out and forcibly stops applications used in industrial control systems.,technology
The FCC is being asked to restore net neutrality rules,technology
Narwhals beat the death sentence of low genetic diversity | Science,science
We’re going to slam a spacecraft into an asteroid to try to deflect it,science
"Iranian security forces massacred dozens last week in the southeastern province of Sistan-Baluchistan when they opened fire on a protest in the city of Zahedan that erupted as Iran is convulsed by nationwide demonstrations, rights activists charge ",politics
"Stop playing with people's lives in eastern Ukraine, Germany tells Russia ",politics
"Fetal brain scans reveal ""blueprint"" of the adult brain. The blueprint of the adult brain may be mapped out far earlier than we thought. In fact, many of the key circuits that make up the adult brain may take shape before we are even born — in the fetal brain",technology
"New research on a March Antarctica cruise (n=217) found 59 percent of passengers and crew members tested positive for Covid-19. Of that group, 81 percent were asymptomatic. The study suggests “silent” symptomless Covid-19 infections may be far more common than previously thought.",science
Genomes from a medieval mass burial show Ashkenazi-associated hereditary diseases pre-date the 12th century,science
Researchers Still Finding Residue From Massive 2010 BP Oil Spill ,politics
Resting brain activity in early childhood predicts IQ at 18 years,science
"The weight of school grades: evidence of biased teachers’ evaluations against overweight students. Results suggested that overweight and obese students were more severely graded, and an indication of heterogeneous penalties by gender, with overweight males being especially penalized.",science
The Stem Cell Gun that Heals Burns in Days,technology
Renewable power that's set to help replace coal-fired power in Australia,technology
India tells Canada to withdraw over 40 diplomatic staff ,politics
Florida's scientist was fired for refusing to 'manipulate' COVID-19 data,politics
You Gave Facebook Your Number For Security. They Used It For Ads.,technology
Italy to make climate change study compulsory in schools,politics
Epson stops making laser printers for sustainability reasons,technology
Germany is considering nationalizing units of 2 Russian energy giants to bolster its energy supply amid the war in Ukraine ,politics
"Google France shuts down its Google+ page, asks users to follow it on Twitter and Facebook instead",technology
Kaspersky Lab Has Been Working With Russian Intelligence - Emails show the security-software maker developed products for the FSB and accompanied agents on raids,technology
"A rare mineral that has allowed Roman concrete marine barriers to survive for more than 2,000 years has been found in the thick concrete walls of a decommissioned nuclear power plant in Japan. The finding could help scientists develop stronger and more eco-friendly concrete.",science
A new study shows that a potential treatment for Alzheimer’s disease may also improve cognitive function in people with Down syndrome.,science
"The planet called HAT-P-32b is losing so much of its atmospheric helium that the trailing gas tails are among the largest structures yet known of an exoplanet, a planet outside our solar system, according to observations by astronomers.",science
"Introverts are more likely to be involuntarily single, and high scorers in openness are more likely to prefer being single.",science
"Russia's nuclear 'rhetoric' is unacceptable, Malta tells UN Security Council ",politics
Backdoored firmware lets China state hackers control routers with “magic packets”,technology
Opinion: Don’t Regulate Facial Recognition. Ban It. We are on the verge of a nightmare era of mass surveillance by the state and private companies. It’s not too late to stop it.,technology
"Self-Driving Farm Robot Uses Lasers To Kill 100,000 Weeds An Hour, Saving Land And Farmers From Toxic Herbicides",technology
"South Korea firm to pay workers $75,000 bonus per baby to fix falling birth rate ",politics
Caltech Develops a Way to Map Brain Circuits in Real Time,technology
5 DNA repair gene mutation may be part of why certain people live extremely long (>105 years),science
Leaked documents reveal hidden details of Putin's 'ghost' train ,politics
The next great debate will be about the role of tech in society and government - Understanding technological disruption is critical for a new generation of policymakers,technology
Russia closes airspace over Sea of Azov starting at midnight ,politics
"Cambodia’s Last Leopards on Brink of Extinction - A new study has confirmed that the world’s last breeding population of leopards in Cambodia is at immediate risk of extinction, having declined 72% during a five-year period. The population represents the last remaining leopards in eastern Indochina.",science
Ten bodies left in SUV outside Mexican state governor’s office | Mexico ,politics
Dutch tv crew drone captures Chinese military conducting riot exercise just outside Hong Kong.,politics
"Capuchin monkeys’ stone-tool use has evolved over 3,000 years",science
Hamas refuses to pause fighting in exchange for release of hostages – The Wall Street Journal ,politics
"When we try to convince others, we search for information in a way biased in our favour. It contributes to make us overconfident.",science
"Study sheds new light on how the brain distinguishes speech from noise. Researchers provide the first physiological evidence that a foundational center of the brain influences how sound is processed, identify a previously unknown neural circuit.",science
"Australia wildfires: Disaster escalates to ‘entirely new level’ as angry firefighter vents rage at PM. ‘Go tell the prime minister to get f*****,’ says firefighter",politics
"""Dark energy"" may simply be the effect of a magnetic-like force interacting with dark matter. When accounting for such a force, a simulation model exactly reproduced the observed expansion of the universe, with no need for a separate dark energy parameter.",science
"California passes law requiring companies to reveal pay by race, gender",technology
Germany threatens sanctions ‘spiral’ unless Belarus frees prisoners ,politics
Remarkable spider with a tail found preserved in amber after 100 million years,science
"Chinese authorities have begun deploying a new surveillance tool called ""gait recognition"" software that uses people's body shapes and how they walk to identify them, even when their faces are hidden from cameras.",politics
"US imposes $150,000 fine on Dish Network for space debris",technology
"Antibiotic Novobiocin found to kill tumor cells with DNA-repair glitch - ""An antibiotic developed in the 1950s and largely supplanted by newer drugs, effectively targets and kills cancer cells with a common genetic defect.""",science
"A Closing Window of Opportunity to Save a Unique Marine Ecosystem: A massive leak of over 1 million barrels of oil is anticipated shortly off the coast of Yemen, in the Red Sea, where the Safer floating storage and offloading unit (FSO) is in the final stages stages of decay.",science
"Spider silk could be used as robotic muscle - Researchers recently discovered a property of spider silk called supercontraction, in which the slender fibers can suddenly shrink in response to changes in moisture.",science
"Conservationists are celebrating the creation of the first privately-owned nature reserve in the Galapagos, after a crowdfunding campaign raised $1.75 million (£1.35m) to save the fragile land from the clutches of developers.",politics
Twitter ran paid ads from China's state news media criticising the Hong Kong protests,politics
"New study suggests early humans could hibernate, but not very well",science
South Korea to impose mandatory COVID tests for travellers from China -News1 ,politics
A Russian soldier complained of being sent to the 'slaughter' against Ukrainian long-range weapons in intercepted audio ,politics
"Austria to close 7 mosques, expel imams in crackdown.",politics
Israeli army denied soldiers threw gas canister into Hebron school. Then a video surfaced.,politics
"Cambridge researchers studying cognition, behaviour and the brain have concluded that people with dyslexia are specialised to explore the unknown. This is likely to play a fundamental role in human adaptation to changing environments.",science
"Armenia-Azerbaijan clashes kill at least 16, undermine regional stability ",politics
"Google pays researcher $70,000 for discovering simple Android lock screen bypass bug",technology
San Jose mayor says he’s quitting FCC broadband committee because Big Telecom is running it.,technology
In a further development of the Facebook scandal Zuckerberg confirms in an interview with a Vox editor that Facebook scans the contents of all private Messenger texts,politics
Russia response to Finland entry to NATO will be a surprise: Zakharova ,politics
Study reveals scale of children orphaned by COVID-19,science
Some Epson Printers Are Programmed to Stop Working After a Certain Amount of Use | Users are receiving error messages that their fully functional printers are suddenly in need of repairs.,technology
13-year-old Ukrainian singer refuses to share stage with Russian performer at Sanremo Junior Festival ,politics
Largest king penguin colony has shrunk nearly 90%,science
Scientists discover potential cause of Alzheimer’s Disease,science
A Trippy Visualization Charts the Internet's Growth Since 1997,technology
North Atlantic climate far more predictable than models imply,science
Google and Mozilla don’t like Apple’s new iOS browser rules,technology
Carlsberg glues beer cans together becoming one of the first breweries to abandon plastic rings,politics
"Patients with lung disease are more likely to develop heart disease independent of any risk factors, according to new research",science
"Scientists discovered microscopic marine microbes that are able to eat away at plastic, causing it to slowly break down. Two types of plastic, polyethylene and polystyrene, lost a significant amount of weight after being exposed to the microbes, which can be engineered to have enhanced qualities.",technology
"Performing oral sex and being the recipient of anal sex can alter the gut microbiome, according to a new study in the Journal of Infectious Diseases.",science
Catalysts found to convert carbon dioxide to fuel,science
"Kyiv region: police confirm the deaths of 1,222 civilians killed by the occupying Russian forces ",politics
Argentinians urged to throw out cocaine after tainted batches kill at least 23 ,politics
Apple Music isn't the best streaming music service — it's just the least annoying,technology
Federal judge rules that a class action lawsuit including millions of Facebook users can proceed with claims that FB violated law around storage of data without user consent,politics
Mexican president calls for Statue of Liberty to be torn down if Assange sentenced in US. ,politics
US stops all aid to Palestinians,politics
Apple supplier Pegatron found using illegal student labor in China ,politics
"Microsoft shuts down Cortana, Apple should do the same with Siri",technology
George W. Bush: There's clear evidence Russia 'meddled' in 2016 election,politics
"A recent experimental study finds that the mere scent of a romantic partner can lower stress levels, even when that partner isn’t physically present",science
"World heritage body Unesco has removed the Belize Barrier Reef from its list of endangered World Heritage Sites; saying the government of the Central American country had taken ""visionary"" steps to preserve it. The reef is the second largest in the world after Australia's Great Barrier Reef.",politics
Putin ‘has killed twice as many civilians as Hitler in Mariupol’ ,politics
Record 1.2 gigawatts of new solar added in Germany in July,technology
FBI is ‘extremely concerned’ about China’s influence through TikTok on U.S. users,technology
The medications that change who we are,science
"Dog owners raise their dog in a way that is similar to the upbringing of children. - ""Parenting styles of dog owners focus on correcting, emotion or trainability of the dog, this knowledge can help to optimize the upbringing of dogs and prevent unwanted behavior.""",science
"‘Anonymous’ sees huge, unexplained surge in support ",politics
"People who grow up with aggressive parents are more likely to use anger words such as “mad,” “hate,” and “stupid” when annoyed or irritated with romantic partners. These moments can escalate into more intense conflict, unless we stop repeating our parents’ communication patterns.",science
"A Pew Research Center study shows that a majority of single women in America are no longer on the dating market for any of marriage, serious relationships or casual sex. 61% of single men are looking for sex or a relationship compared to just 38% of single women",science
"Humanity is ‘cutting down the tree of life’, warn scientists More than 300 mammal species have been eradicated by human activities, say researchers",politics
The Unsolved Mystery of the Earth Blobs - Researchers peering into Earth’s interior found two continent-sized structures that upend our picture of the mantle.,science
"UK citizens were ‘not fully informed on implications of Brexit’, EU report concludes ",politics
Expect more mega-droughts. Droughts that last two decades or longer – are tipped to increase thanks to climate change.,science
"Distributed residential solar+storage takes a seat at the adult table - ~5,000 residential solar+storage batteries have won a bid to provide energy directly to the New England power grid starting in 2022.",technology
"Product design student invented a bioplastic created from fish skin and scales and red algae, a fully biodegradable material called Marinatex, as an environmentally-responsible replacement for plastic film currently used in a whole host of packaging including sandwich boxes.",technology
"China to activate world's first 'clean' nuclear reactor in September. Liquid Thorium instead of uranium. No water cooling. Thorium solidifies on contact with air, if the reactor ever fails.",technology
"A trio of studies published in the journal Nature find that climate change is threatening deciduous and boreal forests in North America, potentially limiting their ability to sequester carbon long-term.",science
"Philippines orders top broadcaster ABS-CBN to halt operations: The Philippines' telecoms body ordered the country's leading broadcaster ABS-CBN Corp to cease operations on Tuesday (May 5), as a parliament dominated by President Rodrigo Duterte's loyalists dragged its feet over renewing its license.",politics
Vindman says White House omitted Trump's reference to Biden tapes in transcript of Zelensky call,politics
"In a study done with mice and published earlier this month in the journal Nutrients, researchers found that a diet high in black raspberries reduced inflammation from contact hypersensitivity – a condition that causes redness and inflammation in the skin.",science
"Google Deletes Thousands of Negative Robinhood Reviews to Save It From 1 Star Rating - Google rushes to delete over 100,000 negative reviews in order to maintain the Robinhood app's rating after heavy review bombing.",technology
The UK May Build a £16 Billion Solar Power Station in Space. Here’s How It Would Work,technology
"Hubble observations of interstellar space, scientists have picked out evidence of a celebrity molecule: ionized Buckminsterfullerene, or buckyballs.",science
"SpaceX execs are accused of joking about sexual harassment and firing workers for speaking up, report says",technology
Russian rocket fuel leak likely cause of marine animal deaths ,politics
"Second generation cryptocurrency payment networks like Ripple Inc's xrapid, will be capable of processing more transactions per second than Visa or Mastercard for 1/10th of a penny per transaction.",technology
"China is poised to overtake the United States as the world's top economy as early as next year. By 2020, a majority of the world population will be classified as middle class. Asia will lead the increase in middle-class populations even as middle classes stagnate in the West.",technology
People scoring higher in narcissism are more likely to choose to engage in grandiose fantasizing to make themselves feel better.,science
Blueleaks: Anonymous leaked 269 gigs data from 200 United States police departments on DDoSecrets ,politics
"We have 48% chance of breaching 1.5°C target by 2026, says Met Office",science
"Tesla Identified As Most Recalled Car Brand, Mercedes & Toyota Least",technology
A major port operator is planning to launch its first hyperloop for cargo in India through a partnership with Virgin Hyperloop One. The concept is designed to propel pods through a large tube underground at speeds of 750 mph using magnets.,technology
"Antigua and Barbuda to vote on whether to remove British monarch as head of state, PM says ",politics
