title,category
"Study: Marijuana Oil ""Significantly Reduced Agitation"" in Dementia Patients",science
Sri Lanka says it is sending 21 containers of recycled waste back to the UK after they were found to contain hazardous material. ,politics
COVID-19 Safety Measures May Have Wiped Out An Entire Flu Lineage,science
"Proportion of cancers associated with excess body weight varies considerably by state, ranging from a high of 8.3% in the District of Columbia to a low of 5.9% in Hawaii, reflecting variations in obesity rates in the states. Cancers related to body weight twice as predominant in women than in men.",science
"Canadian Travelers Fined $20,000 Each After Crossing into Canada From The US With Fake Vaccine Proof ",politics
"A major new study has found children with autism are more likely to be bullied by both their siblings and their peers, meaning that when they return from school, they have no respite from victimisation.",science
Spain: Workers Shut Down Mercedes Factory That Called Its 5000 Employees In During Coronavirus,politics
"Spain Reports 2,000 New Coronavirus Cases, Over 100 Deaths In 24 Hours",politics
Boris Johnson accused of ‘gaslighting’ voters over Brexit deal as EU sources claim he offered nothing new in meeting,politics
"Australian School principal under fire after saying Greta Thunberg has 'mental problems', and only God knows when the World will “wind up”",politics
"Radioactive carbon released into the atmosphere from 20th-century nuclear bomb tests has reached the deepest parts of the ocean, and has been found in muscle tissues of crustaceans that inhabit Earth's ocean trenches, new research says",science
The French government has shut down two nuclear reactors after weeks of drought made the cooling process too difficult to manage.,technology
"Evidence suggests pandemic came from nature, not a lab, panel says",science
Hackers are infecting gamers’ PCs with malware to make millions from crypto,technology
"Rockstar edits out “transphobic” content from GTA V remasters. Apparent change comes after pressure from press, LGBTQ+ developers.",technology
2 GW of Solar Capacity Headed for the US Midwest,technology
"Former Trump campaign adviser Carter Page called allegations that he was a Russian agent “spin,” a “ridiculous smear campaign” and “literally a complete joke” - but admitted that he had worked as an informal adviser to the Russian government.",politics
Walmart Sells Fake 30TB Hard Drive That’s Actually Two Small SD Cards in a Trench Coat,technology
Kid Accidentally Discovered 65 Million Years Old Fossilized Dinosaur Eggs.,science
"A novel flying robot has been developed which can mimic rapid insect flight. The machine is presented as the world's first autonomous, free-flying and agile flapping-wing robot.",science
Ray Kurzweil on humanity's nanobot-filled future,technology
Canada is Making Cosmetic Testing on Animals Illegal,politics
"A new study draws a link between that introduction of American bullfrogs to the western US with the spread of a fungus deadly to amphibians, highlighting the risks of moving animals and plants to new regions.",science
Functioning ‘mechanical gears’ seen in nature for the first time,technology
"Scientists See the Backside of a Black Hole for the First Time, Prove Albert Einstein&#x27;s Theory of General Relativity Correct - IGN News",science
"Island 'levelled', provinces cut off and without power and at least 137 dead after Typhoon Rai hits Philippines ",politics
Egypt bans niqab in schools ,politics
Political analyst urges U.S. to allow Ukraine to bomb Crimean bridge ,politics
Scientists found that individuals with a specific gene variant have a 20% lower risk of developing critical COVID-19 symptoms. This variant was found in 80% of Africans who participated in the study.,science
Ireland will quarantine British travellers because of the UK's 'significantly poorer' response to the coronavirus ,politics
Jeff Bezos 'blackmail' claim puts focus on National Enquirer links to Trump,politics
Meta-analysis of 83 studies produces ‘very strong’ evidence for a negative relationship between intelligence and religiosity,science
New device can make hydrogen when dunked in salt water,science
"People Can Change Their Minds About Vaccines. From January 6 to March 29 of 2021 the percentage of Americans who had received at least one vaccine dose or definitely intended to get the jab increased from 54.7% to 72.3%,",science
"President Donald Trump is a “wimp” and a “liar” and has no intention of speaking with Special Counsel Robert Mueller for the Russia investigation, according to a former congresswoman who took part in the impeachment proceedings of President Richard Nixon.",politics
"Two police officers shot dead in eastern Belgian city of Liège, senate chief says, with reports attacker is killed",politics
Sir Tim Berners Lee on Cambridge Analytica USA: ‘We need to rethink our attitude to web’,technology
"39 nations including US, Japan and many EU nations demand China respect human rights rights in Xinjiang, Tibet and Hong Kong ",politics
Social isolation among older adults linked to having fewer teeth. Study suggests that maintaining and improving social connections may benefit the oral health of older adults.,science
"All adults ages 18 to 79 should be screened for hepatitis C, new recommendation says",science
Engineering professor to develop robotic bees for mapping surface of Mars,technology
Algorithms writing academic books? What gives?,technology
Kids Not Hurt By Screentime - A study finds no deleterious effects on mental health when kids spend their leisure time texting and engaging in other online activities.,science
"Dissociative symptoms are common among individuals with depression, study finds",science
Mossad: Negotiating team in Qatar ordered home as truce talks hit a ‘dead end’ ,politics
Hong Kong police fire tear gas after storming shopping mall,politics
The U.K. Government Is Very Close To Eroding Encryption Worldwide,technology
"In One Massive Attack, Ukrainian Missiles Hit Four Russian Ships—Including Three Landing Vessels ",politics
Russia's RT and Sputnik barred from UK conference on media freedom,politics
‘Nature needs money’: Lula tells rich countries to pay up and protect world’s rainforests ,politics
Enhanced rationality in autism spectrum disorder [Empirical evidence strongly suggests that individuals with ASD display enhanced rationality: judgments that are more objective and decision-making that is less biased than that of neurotypical individuals.],science
Electric vehicles already able to cut greenhouse gas emissions by half.,science
Court charges dev with hacking after cybersecurity issue disclosure,technology
Breaking down fat byproducts could lead to healthier aging − researchers identify a key enzyme that does just that,science
"Big Tech is bracing for a possible recession, spooking other industries | Google’s CEO warned “sunnier days"" are over as tech giants report slowing growth and cut down on hiring",technology
The numbers show Gen Z is actually the pro-choice generation,science
Fast radio bursts used as 'searchlights' to detect gas in Milky Way: Canadian scientists find Galactic Halo weighs much less than previously thought,science
Physicists Are Studying Mysterious ‘Bubbles of Nothing’ That Eat Spacetime,science
"There are measurable and repeatable epigenetic differences between the brains of zebra finches who receive tutoring, and those that do not. The results of this study could have future implications for helping trauma patients to prevent encoding those events into their long-term memory",science
"Electricity may slow – and in some cases, stop – the speed at which breast cancer cells spread through the body, a new study indicates. The research also found that electromagnetic fields might hinder the amount of breast cancer cells that spread.",science
'We Are Not Bots': Facebook Censors U.S. Activists After Falsely Claiming They 'Unwittingly' Planned Protest,technology
"Two species of large river fish have been declared extinct in China, despite decades of work to save their populations ",politics
Leader of DNP (Eastern Ukrainian region) calls on emergency evacuation of residents to Russia ,politics
Meta shares sink another 12% after record drop last week,technology
New theory of quantum mechanics shows matter is not in the eye of the observer - The measurement problems has plagued theoretical physics for nearly 100 years,technology
"SpaceX Wins Permission to Connect Planes, Boats and Other Vehicles to Starlink Internet Service",technology
DeepMind says it will release the structure of every protein known to science,technology
Study finds US life expectancy behind other rich nations,science
Occupations for males with the highest overall prevalence of obesity were Motor Vehicle Operation (31.7%) and Police and Firefighting (29.8%),science
"Fracking caused the biggest earthquake in Alberta's history, seismologist says ",politics
"Listening to heavy metal music can be a healthy way to process anger and improve mental health. While rebellion is a core theme in metal, it does not amplify violent tendencies in humans.",science
Khashoggi's fiancee urges Justin Bieber to cancel Saudi performance ,politics
"Germany: Over 1,400 youths accuse Catholic religious orders of sexual abuse ",politics
"Yes, Facebook is spying on you - and here’s how they’re doing it.",technology
"Taxes on sugary products and labels on the front of packages can help reduce sugar consumption, according to a new study, which found taxes could have greatest impact if 100% fruit juice was included in reduction efforts. “Industry lobbying has delayed and threatens to derail the nutrition labels.”",science
"Donald Trump dumped $400 million into his clubs in Aberdeen and Turnberry. Now, lawmakers in Edinburgh want to investigate him for money laundering. ",politics
"​Just 5 Percent of Electric Plants Responsible for 73 percent of Power Sector Emissions. Switching from coal to oil or gas would lower emissions by around 30 percent, while installing carbon capture technology would slash emissions nearly in half.",science
Oxytocin treatment can take lions from ferocious to friendly,science
"Facebook Is Designed to Spread Covid Misinformation - The White House wants Facebook to crack down on anti-vax posts, but that would require the social media giant to transform on a fundamental level.",technology
"Study: ""Stop saying that weed cures cancer""",science
The unlikely partnership that might decide the future of meat,technology
"I am in the final year of my PhD in the electronic behaviour of perovskite solar cells, a new solar cell which may (hopefully!) change the energy harvesting landscape in the next few years. As a side project, I have spent a couple of months making this video to describe the field, enjoy!",technology
US navy hospital ship stokes tensions by giving Venezuelan refugees free care,politics
Pharmacies nationwide unable to fulfill prescriptions due to cyber attack,technology
California DMV accuses Tesla of falsely advertising Autopilot and Full Self-Driving features,technology
"Sam Bankman-Fried thought there was a 5% chance he would be president, Caroline Ellison testified in his trial",technology
The Last Thing We Need Is an Uber for Off-Duty Cops - Private businesses are paying police big bucks to work during their off-hours. Now a slew of start-ups are looking for a piece of that action.,technology
"Robots made of Branches learn to walk, future robots could learn to move assimilating any nearby materials.",technology
One Man’s Fight for the Right to Repair Broken MacBook. He started as just 'a random person ranting at a camera for therapy.',technology
The Rise of Fake News. A Machine Learning challenge,technology
"Japanese researchers have mapped vast reserves of rare earth elements in deep-sea mud, enough to feed global demand on “semi-infinite basis.” The deposit, found within Japan’s exclusive economic zone waters, contains more than 16 million tons of elements needed to build high-tech products.",politics
Pentagon chief of staff resigns amidst growing Iran tensions,politics
Engineered nanoparticles injected within or outside the window of breached blood-brain barrier in traumatic brain injury (TBI) mice showed threefold higher brain accumulation. Data suggests that this nanoparticle platform is a promising next-generation drug delivery approach for the treatment of TBI,science
Trump told Theresa May he doubted Russia was behind Skripal poisoning,politics
Anticholinergic drugs increase risk of mortality in people with dementia. Patients who were given respiratory and urological drugs in particular had significantly increased mortality rates. Diazepam and risperidone were the two most commonly prescribed drugs.,science
"The CDC reports that the age-adjusted death rate increased by 15.9% in 2020 from 715.2 to 828.7 deaths per 100,000 population according to provisional mortality data. COVID-19 was the third leading cause of death behind heart disease and cancer.",science
AI player creates strikingly realistic virtual tennis matches based on real players,technology
Vibrating haptic suits give deaf people a new way to feel live music,technology
US Growth Seen Outpacing China’s for First Time Since 1976 ,politics
"Scientists create intratumoral device to deliver drugs directly into the tumor. Smaller than a grain of rice, this tiny nanodevice delivers immunotherapy straight into a tumor, eliminating both side effects and the need for multiple IV treatments.",science
Deputy Head of Russia’s Security Council threatens to strike German missiles manufacturing plants ,politics
"If Apple is the only organisation capable of defending our privacy, it really is time to worry.",technology
U.S. Provided Canada With Intelligence on Killing of Sikh Leader ,politics
Russia May Attack Third-Country Airfields If Ukrainian F-16 Are Based On Them - Putin ,politics
"Thousands rally in Hong Kong in fresh protests, marchers defy police ban - Anti-government protests took place in different locations across the Asian financial hub, including one at the city’s international airport for a third day.",politics
Researchers in Germany found there was no evidence of longer life expectancy in people who drink in moderation. The findings speak against recommendations to drink alcohol for health reasons.,science
A hacker tried to poison a California water supply. It was as easy as entering a password.,technology
"Drug treatment stopped transmission of HIV in gay couples,study finds,A European study of nearly 1,000 gay male couples who had sex without condoms — where one partner had HIV and was taking antiretroviral drugs to suppress it — has found the treatment can prevent sexual transmission of the virus.",science
"Bezos says Amazon workers aren’t treated like robots, unveils robotic plan to keep them working | He didn’t specifically mention the peeing in bottles, however",technology
Windows 10 end of life could prompt torrent of e-waste as 240 million devices set for scrapheap,technology
Adobe Photoshop Designers Are Furious That Pantone Is Forcing Them to Pay $15 to Use Its Colors,technology
"Worker ants vault to queenly rank after just one gene turns on. A single gene can determine whether an ant is a worker or royalty, by triggering a cascade of brain changes that alter the insect’s behaviour.",science
"Tasmania to reach 120% renewable electricity in five years, Labor pledge",politics
Two thirds of Russian population regrets the collapse of the Soviet Union in a 14 year high point,politics
Canada expels Indian diplomat as it investigates India's possible link to Sikh activist's slaying ,politics
"iPhone apps no better for privacy than Android, Oxford study finds",technology
How big will Facebook settlement checks be? Lawyers reveal estimated payment per person,technology
"Children not only have fatigue-resistant muscles, but recover very quickly from high-intensity exercise -- even faster than well-trained adult endurance athletes, according to a new study.",science
Russian soldiers say they dream of conquering Ukrainian cities and moving their families there in haunting recruitment ad ,politics
"Congress’s Social Security Numbers Leaked in Health Data Breach | Reporters spoke to the bad guys selling lawmakers' data, which leaked in a health insurance security breach.",technology
Legal Cannabis hemp oil effectively treats chronic neuropathic pain,science
It's a joke right: How Cloudflare's wall of lava lamps helps keep the internet safe,technology
Finland passes new trans rights laws on gender recognition ,politics
"We are running out of time to reach deal to save natural world, says UN talks chair ",politics
More than 80 candidates and politicians have been killed since Mexico's election season took off in September - as drug cartels wrestle for power,politics
Odysseus has less than a day left on the Moon before it freezes to death,technology
Vice Media nears deal for $400 million sale out of bankruptcy.,technology
China to step up tree planting campaign to help reach net zero ,politics
"Greece angrily rejects Erdoğan's proposed soldier swap - Turkey’s president, Recep Tayyip Erdoğan, has sparked anger with a proposal that two Greek border guards detained in the country since March be exchanged for eight Turkish officers who have sought asylum in Greece.",politics
"Netflix to Employees: If You Don’t Like Our Content, You Can Quit",technology
"Meta's value has plunged by $700 billion. Wall Street calls it a ""train wreck.""",technology
"“Privacy is not for sale,” Telegram founder says after being banned in Russia",technology
"There is a entire state without energy and water in Brazil. Food and water shortages, people can't acess their credit cards, riots. and the government hasn't commented yet ( 9 days have been passed ) ",politics
Texas passes law that bans kicking people off social media based on ‘viewpoint’,technology
Cannabis Oils Effective for Older Patients With Neurological Diseases,science
Facebook misled investors about battling climate and COVID lies: SEC filings,technology
Mexico warns Venezuelan migrants not to form caravans ,politics
Apple might reveal a proper gaming product at its October event,technology
Trump 'Home Alone 2' scene cut from Canadian Christmas broadcasts,politics
"Cultured meat, also known as clean, cell-based or slaughter-free meat, is grown from stem cells taken from a live animal without the need for slaughter. If commercialized successfully, it could solve many of the environmental, animal welfare and public health issues of animal agriculture.",technology
Elon Musk’s legal case against OpenAI is hilariously bad,technology
"Virginia governor kills Ford-CATL battery plant, calling it a “front for the Chinese Communist Party”",technology
"President Trump has indicated that he is considering pardons for several American military members accused or convicted of war crimes, including high-profile cases of murder, attempted murder and desecration of a corpse, according to two United States officials.",politics
The dark side of social media on youth mental health,technology
"Melt ponds open in Arctic as permafrost melts at levels not expected until 2090. Series of 'anomalously warm summers' caused ground to thaw, researchers say",science
‘I’ve never seen heat this bad. It’s not normal’: Italy struggles as temperature tops 40C | Italy | The Guardian ,politics
"Wealthier people do less in the struggle against climate change, finds a new experiment where participants act collectively against global warming. Those with fewer resources were prepared to contribute significantly more to the public good than wealthier people, sometimes up to twice as much.",science
Brain implant and signal decoder reversed paralysis,science
"Russia and China are developing 'destructive' space weapons, US intelligence warns",politics
"Managers Are Already Trying to Bust eBay's First Union, Organizers Say",technology
FCC declines to punish Sinclair for its ‘must-run’ segments and scripts,technology
Cases of cognitive decline in older people more than doubles in ten years,science
Israeli High Court orders demolition of Palestinian homes,politics
"New research shows that maternal exposure to a common and ubiquitous form of industrial pollution can harm the immune system of offspring and that this injury is passed along to subsequent generations, weakening the body's defenses against infections such as the influenza virus.",science
Tesla owner gets chip implanted in hand to unlock car,technology
Russia-Africa Summit turns to be diplomatic fiasco: Boycott among African nations ,politics
Revealed: Google illegally underpaid thousands of workers across dozens of countries,technology
U.S. senators introduce bill to help Ukraine counter Russian aggression ,politics
"Research suggests that our brains are like modern washing machines -- evolved to have the latest sophisticated programming, but more vulnerable to breakdown and prone to develop costly disorders.",science
"Some ISPs Exploited Covid Broadband Relief Program to Make an Extra Buck - While the $3.2 billion program provides relief to struggling Americans, some ISPs are abusing it to make an additional buck during a crisis.",technology
"Scientists from the University of Wisconsin-Madison & Harvard Medical School has found evidence that suggests meditating daily may slow brain aging. In their paper published in the journal Neurocase, they describe their study of a Buddhist monk who meditates daily & what they learn from him.",science
IRS will let taxpayers opt out of ID.me facial recognition with a live interview.,technology
It’s time to give Firefox a fresh chance,technology
Physical exertion increases men's responses to sexual stimuli,science
NASA’s Hubble Space Telescope measurements show Universe expanding faster then expected,science
"Kim Jong-un letter to Seoul asks for more summits in 2019 - North Korea's leader Kim Jong-un has vowed to ""frequently"" meet South Korea's President Moon Jae-in next year to discuss denuclearisation.",politics
Biden approves $100m emergency funds to resettle Afghan refugees ,politics
Tiny turtle pooed ‘pure plastic’ for six days after rescue from Sydney beach | Plastic bags ,politics
Australia to buy long-range HIMARS missile system from United States after Ukraine praises weapon's effectiveness against Russia - ABC News ,politics
"Cannabis Decriminalization and Legalization and Road Safety Outcomes: A systematic review finds, among other things, medical legalization was associated with reductions in fatal motor-vehicle collisions, whereas recreational legalization was conversely associated with increases in fatal collisions.",science
"After the shooting at Sandy Hook, people bought more guns than ever before. These additional guns then led to an increase in domestic homicides.",science
"A new study presents the first evidence of Neanderthals hunting cave lions. Puncture wounds on a 48,000-year-old ribcage could be the earliest direct instance of a large predator kill in human history.",science
"Lab-Grown Meat: One Startup Has an Idea That Could Dramatically Slash Costs — thanks to one London-based startup, prices could drop to just $15 per burger",technology
"In an Epic Battle of Tanks, Russia Was Routed, Repeating Earlier Mistakes ",politics
"Teenagers and young adults who vape face a much higher risk of COVID-19 than their peers who do not vape. Teen vapers are 7 times more likely to get COVID-19, according to a new study by the Stanford University School of Medicine.",science
Worlds first solar train. 100% electricity provided by solar.,technology
Elon Musk says Boring Company tunnel under LA will now open on Dec. 18,technology
Matching female university students with female advisors increases retention and GPA,science
Tomato fruits send electrical warnings to the rest of the plant when attacked by insects,science
"How Brain Biology Promotes Starvation in Patients with Anorexia Nervosa. Results support the idea that the brain in anorexia is able to recognize hunger signals, but individuals with the disorder may lack an intuitive drive to consume food",science
"Food-seeking behavior is triggered by skin ultraviolet exposure in males: Here we show that solar exposure induces food-seeking behavior, food intake, and food-seeking behavior and food intake in men, but not in women.",science
Should customers be able to repair their devices? This federal agency says yes.,technology
"Goats are drawn to humans with happy facial expressions, scientists find",science
"Opioid Deaths Rise When Auto Plants Close, Study Shows",science
"Police officers with a more empathetic approach toward criminal justice do not seem to perform as well when they feel they are underappreciated by the public, but officers with a conservative leaning, favoring punitive approaches to justice, did not see their performance falter, finds new study.",science
"The largest comet ever seen, estimated to have an 80-mile nucleus, is barreling toward the inner solar system ",politics
These Google employees used their '20 percent' time to improve Maps for people in wheelchairs,politics
UK may force Facebook services to allow backdoor police access,technology
"In France, Amazon loses court appeal and must stop selling nonessential items to protect workers",politics
"‘Keep calm and count on’ Experts say the election was never going to be decided on Nov. 3, but that’s normal and good ",politics
"Single life gets better with age, new research show - Over the course of their adult lives, and over time historically, single people become more satisfied with their lives.",science
Warren Buffett Questions the Need for Office Space,technology
